{
  "contractId": "J-90",
  "schemaVersion": "1.0.0",
  "evaluatorId": "EV-01",
  "runId": "RUN-001-EV01",
  "generatedAt": "2026-07-13T00:10:00Z",
  "target": [
    "J-10-ui-structure.example.json"
  ],
  "result": "PASS",
  "checks": [
    {
      "checkId": "EV01-01",
      "name": "原本裏付け",
      "result": "PASS",
      "details": "1件を確認。"
    }
  ],
  "findings": [],
  "metrics": {
    "checkedRecordCount": 1,
    "missingRecordCount": 0,
    "unsupportedFactCount": 0,
    "untraceableRecordCount": 0,
    "unaccountedSourceUnitCount": 0
  },
  "humanReviewStatus": "not_reviewed"
}
